series,episode,baker_name,first_name,technical,result,signature_bake,show_stopper,baker_age,baker_occupation,hometown
1,1,Annetha Mills,Annetha,2,IN,Light Jamaican Black Cakewith Strawberries and Cream,"Red, White & Blue Chocolate Cake with Cigarellos, Fresh Fruit, and Cream",30,Midwife,Essex
1,2,Annetha Mills,Annetha,7,OUT,Rose Petal Shortbread,Pink Swirl Macarons / Eclairs,30,Midwife,Essex
1,3,Annetha Mills,Annetha,NA,NA,NA,NA,30,Midwife,Essex
1,4,Annetha Mills,Annetha,NA,NA,NA,NA,30,Midwife,Essex
1,5,Annetha Mills,Annetha,NA,NA,NA,NA,30,Midwife,Essex
1,6,Annetha Mills,Annetha,NA,NA,NA,NA,30,Midwife,Essex
1,1,David Chambers,David,3,IN,Chocolate Orange Cake,"Black Forest Floor Gateauxwith Moulded Chocolate Leaves, Fallen Fruitand Chocolate Mushrooms Moulded from eggs",31,Entrepreneur,Milton Keynes
1,2,David Chambers,David,8,IN,Cheddar Cheese and Fresh Rosemary Biscuits,Choux Pastry Swans  Chocolate Profiteroles,31,Entrepreneur,Milton Keynes
1,3,David Chambers,David,4,IN,Chilli Bread,"Walnut and Seed Roll
Red Berry and Almond Bun",31,Entrepreneur,Milton Keynes
1,4,David Chambers,David,5,OUT,Pear and Walnut Pudding,"Apple and Blackberry Crumble, Rhubarb and Orange Betty, Suet Pear",31,Entrepreneur,Milton Keynes
1,5,David Chambers,David,NA,NA,NA,NA,31,Entrepreneur,Milton Keynes
1,6,David Chambers,David,NA,NA,NA,NA,31,Entrepreneur,Milton Keynes
1,1,Edd Kimber,Edd,1,IN,Caramel Cinnamon and Banana Cake,N/A,24,Debt collector for Yorkshire Bank,Bradford
1,2,Edd Kimber,Edd,6,IN,Oatmeal Raisin Cookie,Pink Macarons,24,Debt collector for Yorkshire Bank,Bradford
1,3,Edd Kimber,Edd,1,IN,Olive Bread,Tomato and Mozzarella,24,Debt collector for Yorkshire Bank,Bradford
1,4,Edd Kimber,Edd,3,IN,Apple and Plum Pudding,"Apple and Cinnamon Crumble, Nutella Banana Brioche Bread Pudding, Rhubarb and Strawberry Suet Layer",24,Debt collector for Yorkshire Bank,Bradford
1,5,Edd Kimber,Edd,2,IN,"Chicken, Ham, Leek and Tarragon Pie","Almond Sweet Pastry with Ginger and Chocolate  Raspberry Tart / Yorkshire Curd Tart  Chickpea and Salami, Red and Yellow Pepper, Asparagus Gruyere Quiche Canapés",24,Debt collector for Yorkshire Bank,Bradford
1,6,Edd Kimber,Edd,NA,WINNER,Cinnamon and Banana Cake,NA,24,Debt collector for Yorkshire Bank,Bradford
1,1,Jasminder Randhawa,Jasminder,NA,IN,Fresh Mango and Passion Fruit Hummingbird Cake,N/A,45,Assistant Credit Control Manager,Birmingham
1,2,Jasminder Randhawa,Jasminder,2,IN,Millionaires' Shortbread,Meringues with Chocolate and Space DustCoffee flavoured Eclairs,45,Assistant Credit Control Manager,Birmingham
1,3,Jasminder Randhawa,Jasminder,5,IN,Focaccia,"Mango and Sultana Buns
Pan au Chocolat with Mars Bars
Tutti Frutti Wheel with Jelly Tots",45,Assistant Credit Control Manager,Birmingham
1,4,Jasminder Randhawa,Jasminder,2,IN,Sticky Toffee Pudding with Tropical Fruit & Toffee Sauce,"Bread & Butter Pudding, Treacle Suet Pudding with Fresh Fruit, Apple and Pineapple Crumble",45,Assistant Credit Control Manager,Birmingham
1,5,Jasminder Randhawa,Jasminder,4,OUT,Chicken and Mushroom Pie,"Jaggery, Carrot, and Spiced Condensed Milk Tart  Fruit and Custard Tart  Thai Chili Red Onion, Duck in Plum Sauce, Salmon and Prawn Canapés",45,Assistant Credit Control Manager,Birmingham
1,6,Jasminder Randhawa,Jasminder,NA,NA,NA,NA,45,Assistant Credit Control Manager,Birmingham
1,1,Jonathan Shepherd,Jonathan,9,IN,Carrot Cake with Lime and Cream Cheese Icing,Three Tiered White and Dark Chocolate with Almond and Cherry,25,Research Analyst,St Albans
1,2,Jonathan Shepherd,Jonathan,1,IN,Honey and Candied Ginger Cookies,Meringues with Whiskey Cream,25,Research Analyst,St Albans
1,3,Jonathan Shepherd,Jonathan,6,OUT,"Anchovy, Sweet Paprika and Oregano Bread","Sticky Lemon Honey Bun
Olive and Anchovy Roll
Sundried Tomatoes and Fresh Herbs Roll
Stilton, Walnut and Apple Roll
Cinnamon and Cardamom Chelsea Bun",25,Research Analyst,St Albans
1,4,Jonathan Shepherd,Jonathan,NA,NA,NA,NA,25,Research Analyst,St Albans
1,5,Jonathan Shepherd,Jonathan,NA,NA,NA,NA,25,Research Analyst,St Albans
1,6,Jonathan Shepherd,Jonathan,NA,NA,NA,NA,25,Research Analyst,St Albans
1,1,Lea Harris,Lea,10,OUT,Cranberry and Pistachio Cakewith Orange Flower Water Icing,Raspberries and Cream filled Chocolatewith Chocolate-dipped Fresh Fruit,51,Retired,"Midlothian, Scotland"
1,2,Lea Harris,Lea,NA,NA,NA,NA,51,Retired,"Midlothian, Scotland"
1,3,Lea Harris,Lea,NA,NA,NA,NA,51,Retired,"Midlothian, Scotland"
1,4,Lea Harris,Lea,NA,NA,NA,NA,51,Retired,"Midlothian, Scotland"
1,5,Lea Harris,Lea,NA,NA,NA,NA,51,Retired,"Midlothian, Scotland"
1,6,Lea Harris,Lea,NA,NA,NA,NA,51,Retired,"Midlothian, Scotland"
1,1,Louise Brimelow,Louise,NA,IN,Carrot and Orange Cake,"Never Fail Chocolate Sponge Cake,with Fresh Fruit, White & Chocolate Cigarello Border",44,Police Officer,Manchester
1,2,Louise Brimelow,Louise,4,OUT,Stained Glass Window Shortbread,"Strawberry, Mint, and Cream Meringues  Chocolate Eclairs / Orange, Yellow and Pink Macarons",44,Police Officer,Manchester
1,3,Louise Brimelow,Louise,NA,NA,NA,NA,44,Police Officer,Manchester
1,4,Louise Brimelow,Louise,NA,NA,NA,NA,44,Police Officer,Manchester
1,5,Louise Brimelow,Louise,NA,NA,NA,NA,44,Police Officer,Manchester
1,6,Louise Brimelow,Louise,NA,NA,NA,NA,44,Police Officer,Manchester
1,1,Mark Whithers,Mark,NA,OUT,Sticky Marmalade Tea Loaf,Heart-shaped Chocolate and Beetroot Cake with Store-Bought silver chocolate hearts and chocolate red and white roses.,48,Bus Driver,South Wales
1,2,Mark Whithers,Mark,NA,NA,NA,NA,48,Bus Driver,South Wales
1,3,Mark Whithers,Mark,NA,NA,NA,NA,48,Bus Driver,South Wales
1,4,Mark Whithers,Mark,NA,NA,NA,NA,48,Bus Driver,South Wales
1,5,Mark Whithers,Mark,NA,NA,NA,NA,48,Bus Driver,South Wales
1,6,Mark Whithers,Mark,NA,NA,NA,NA,48,Bus Driver,South Wales
1,1,Miranda Browne,Miranda,8,IN,"Triple Layered Brownie Meringue Cake
with Raspberry Cream",Three Tiered Chocolate Fudge Cake  with Handmade Chocolate Button Decorations,37,Food buyer for Marks & Spencer,"Midhurst, West Sussex"
1,2,Miranda Browne,Miranda,3,IN,Fresh Vanilla Biscuits with Royal Icing,Pistachio Macarons,37,Food buyer for Marks & Spencer,"Midhurst, West Sussex"
1,3,Miranda Browne,Miranda,3,IN,Walnut and Apricot Bread,"Lemon Iced Buns
Chocolate and Orange Buns",37,Food buyer for Marks & Spencer,"Midhurst, West Sussex"
1,4,Miranda Browne,Miranda,1,IN,Sticky Toffee Pudding,"Queen of Puddings, Chocolate Pear Roly Poly, Strawberry and Rhubarb Crumble",37,Food buyer for Marks & Spencer,"Midhurst, West Sussex"
1,5,Miranda Browne,Miranda,1,IN,"Summery Salmon, Cod and Prawn Fish Pie","Chocolate Pastry filled with Orange Cheesecake  Chocolate Pastry filled with Milk Chocolate Ganche  Strawberry Tart with Red Currant Glaze  Cheesy Crab, Broad Bean and Tomato, Pancetta Risotto Canapés",37,Food buyer for Marks & Spencer,"Midhurst, West Sussex"
1,6,Miranda Browne,Miranda,NA,Runner-up,Lemon Cupcake,Eliminated after signature,37,Food buyer for Marks & Spencer,"Midhurst, West Sussex"
1,1,Ruth Clemens,Ruth,NA,IN,Three Tiered Lemon Drizzle Cakewith Fresh Cream and freshly made Lemon Curd,Classic Chocolate Sponge wrapped in a Chocolate Collartopped with Handmade White and Dark Chocolate Truffles,31,Retail manager/Housewife,"Poynton, Cheshire"
1,2,Ruth Clemens,Ruth,5,IN,Peanut Shortbread withSalted Peanut Caramel,Almond Macaron with Violet ButtercreamRaspberries and Cream Eclairs,31,Retail manager/Housewife,"Poynton, Cheshire"
1,3,Ruth Clemens,Ruth,2,IN,Maple and Pecan Bread,"Chocolate and Orange Panettone
Cranberry Bagels",31,Retail manager/Housewife,"Poynton, Cheshire"
1,4,Ruth Clemens,Ruth,4,IN,Peach and Blueberry Boy Bait,"Apple & Ginger Crumble, Rhubarb Suet Crust, Cherry Queen of Puddings",31,Retail manager/Housewife,"Poynton, Cheshire"
1,5,Ruth Clemens,Ruth,3,IN,Minced Beef Pie,"Raspberry and Dark Chocolate Tart  Creme Patisserie and Cherry Tart  Citrus Curd Tart with Creme Brulee top  Tomato, Asparagus Twirl Canapés",31,Retail manager/Housewife,"Poynton, Cheshire"
1,6,Ruth Clemens,Ruth,NA,Runner-up,"Mint, Ginger and Blackberry Cake",NA,31,Retail manager/Housewife,"Poynton, Cheshire"
2,1,Ben Frazer,Ben,2,IN,Rhubarb and Custard CupcakesAfter Dinner Cupcakes,Vanilla Sponge with White Chocolate and Raspberry Buttercream,31,Graphic Designer,Northampton
2,2,Ben Frazer,Ben,1,IN,"Chorizo, Pepper and Gruyere Quiche",Lemon Meringue Tarts,31,Graphic Designer,Northampton
2,3,Ben Frazer,Ben,3,IN,"Walnut, Raisin and Rosemary Loaf",UNKNOWN,31,Graphic Designer,Northampton
2,4,Ben Frazer,Ben,5,OUT,Stem Ginger Nuts,Chocolate and Almond MacaronsPine Nut MacaronsPistachio Macarons,31,Graphic Designer,Northampton
2,5,Ben Frazer,Ben,NA,NA,NA,NA,31,Graphic Designer,Northampton
2,6,Ben Frazer,Ben,NA,NA,NA,NA,31,Graphic Designer,Northampton
2,7,Ben Frazer,Ben,NA,NA,NA,NA,31,Graphic Designer,Northampton
2,8,Ben Frazer,Ben,NA,NA,NA,NA,31,Graphic Designer,Northampton
2,1,Holly Bell,Holly,1,STAR BAKER,Cherry Bakewell Inspired CupcakesGinger Cupcakes with Fig Truffle,UNKNOWN,31,Advertising executive,Leicester
2,2,Holly Bell,Holly,4,IN,Pesto Quiche,Milk Chocolate and Pistachio TartsTrifle Tarts,31,Advertising executive,Leicester
2,3,Holly Bell,Holly,6,IN,Picnic Loaf,Stilton and Walnut Rolls,31,Advertising executive,Leicester
2,4,Holly Bell,Holly,3,STAR BAKER,Strawberry and Custard Melts,"'Chocolate bars of my youth'
(Caramel Macarons, Mint Chocolate Macarons and Chocolate Orange Macarons)",31,Advertising executive,Leicester
2,5,Holly Bell,Holly,4,IN,"Stilton, Potato and Caramelised Onion Pie",Lime Meringue Pie,31,Advertising executive,Leicester
2,6,Holly Bell,Holly,3,IN,Father Christmas' Baked Cheesecake,Hansel and Gretel's Croquembouche,31,Advertising executive,Leicester
2,7,Holly Bell,Holly,1,IN,"White Chocolate, Hazelnut and Raspberry Genoise Mousse Cake","Apricot, Macadamia and White Chocolate PinwheelsAlmond CroissantsApple, Raisin and Cinnamon Plaits",31,Advertising executive,Leicester
2,8,Holly Bell,Holly,2,Runner-up,Banoffee Inspired Mille Feuille,Strawberry and Cream Meringue NestGooseberry and Elderflower 'Bakewell' TartsNeapolitan Ice-Cream Sandwich,31,Advertising executive,Leicester
2,1,Ian Vallance,Ian,10,IN,Apple and Cinnamon Cupcakes,UNKNOWN,40,Fundraiser for English Heritage,"Dunstable, Bedfordshire"
2,2,Ian Vallance,Ian,2,IN,"Stilton, Spinach and New Potato Quichewith Paprika and Walnut Pastry",UNKNOWN,40,Fundraiser for English Heritage,"Dunstable, Bedfordshire"
2,3,Ian Vallance,Ian,10,OUT,"Courgette, Caerphilly Cheese and Thyme Loaf",Walnut and Raisin RollsCracked Wheat Logs,40,Fundraiser for English Heritage,"Dunstable, Bedfordshire"
2,4,Ian Vallance,Ian,NA,NA,NA,NA,40,Fundraiser for English Heritage,"Dunstable, Bedfordshire"
2,5,Ian Vallance,Ian,NA,NA,NA,NA,40,Fundraiser for English Heritage,"Dunstable, Bedfordshire"
2,6,Ian Vallance,Ian,NA,NA,NA,NA,40,Fundraiser for English Heritage,"Dunstable, Bedfordshire"
2,7,Ian Vallance,Ian,NA,NA,NA,NA,40,Fundraiser for English Heritage,"Dunstable, Bedfordshire"
2,8,Ian Vallance,Ian,NA,NA,NA,NA,40,Fundraiser for English Heritage,"Dunstable, Bedfordshire"
2,1,Janet Basu,Janet,8,IN,Raspberry and Cream Cupcakes,Chocolate Marble Cakewith Dark and White Chocolate Truffles,63,Teacher of Modern Languages,"Formby, Liverpool"
2,2,Janet Basu,Janet,8,IN,Quiche Printanière,Red Fruit TartsChocolate and Cherry Tarts,63,Teacher of Modern Languages,"Formby, Liverpool"
2,3,Janet Basu,Janet,8,IN,Zupfe Loaf with Gruyère Cheese,Apple and Walnut Granary Rolls Red Onion Cottage Rolls,63,Teacher of Modern Languages,"Formby, Liverpool"
2,4,Janet Basu,Janet,4,IN,Christmas Marzipan Biscuits,"Raspberry Macarons
Blackcurrant Macarons
Almond Macarons",63,Teacher of Modern Languages,"Formby, Liverpool"
2,5,Janet Basu,Janet,1,STAR BAKER,Chicken and Chestnut Pie,Rhubarb Meringue Pie,63,Teacher of Modern Languages,"Formby, Liverpool"
2,6,Janet Basu,Janet,5,IN,Rhubarb and Ginger Baked Cheesecake,Orange and Nougatine Croquembouche,63,Teacher of Modern Languages,"Formby, Liverpool"
2,7,Janet Basu,Janet,4,OUT,Chocolate Amaretto Mousse Cake,Pain Aux RaisinPlain CroissantPain Au Chocolat,63,Teacher of Modern Languages,"Formby, Liverpool"
2,8,Janet Basu,Janet,NA,NA,NA,NA,63,Teacher of Modern Languages,"Formby, Liverpool"
2,1,Jason White,Jason,6,IN,Lemon Meringue CupcakesApple and Cinnamon Cupcakes,UNKNOWN,19,Civil Engineering Student,Croydon
2,2,Jason White,Jason,3,STAR BAKER,Salmon and Pak Choi Quiche,Mint Chocolate Tarts Blueberry Bakewell Tarts,19,Civil Engineering Student,Croydon
2,3,Jason White,Jason,7,IN,Cheese and Onion Tear and Share Loaf,UNKNOWN,19,Civil Engineering Student,Croydon
2,4,Jason White,Jason,1,STAR BAKER,Lebkuchen,"Mocktail Macarons
(Mojito, Cranberry Cooler, and Pina Colada)",19,Civil Engineering Student,Croydon
2,5,Jason White,Jason,7,OUT,Brown Down Chicken Pie,Plum Meringue Pie,19,Civil Engineering Student,Croydon
2,6,Jason White,Jason,NA,NA,NA,NA,19,Civil Engineering Student,Croydon
2,7,Jason White,Jason,NA,NA,NA,NA,19,Civil Engineering Student,Croydon
2,8,Jason White,Jason,NA,NA,NA,NA,19,Civil Engineering Student,Croydon
2,1,Keith Batsford,Keith,12,OUT,Earl Grey Cupcakes,Chocolate and Sour Cream Cake,31,House husband,"Arlesey, Bedfordshire"
2,2,Keith Batsford,Keith,NA,NA,NA,NA,31,House husband,"Arlesey, Bedfordshire"
2,3,Keith Batsford,Keith,NA,NA,NA,NA,31,House husband,"Arlesey, Bedfordshire"
2,4,Keith Batsford,Keith,NA,NA,NA,NA,31,House husband,"Arlesey, Bedfordshire"
2,5,Keith Batsford,Keith,NA,NA,NA,NA,31,House husband,"Arlesey, Bedfordshire"
2,6,Keith Batsford,Keith,NA,NA,NA,NA,31,House husband,"Arlesey, Bedfordshire"
2,7,Keith Batsford,Keith,NA,NA,NA,NA,31,House husband,"Arlesey, Bedfordshire"
2,8,Keith Batsford,Keith,NA,NA,NA,NA,31,House husband,"Arlesey, Bedfordshire"
2,1,Mary-Anne Boermans,Mary-Anne,4,IN,Banoffee Cupcakes,Chocolate and Raspberry Opera cake,45,Housewife,"Kidderminster, Worcestershire"
2,2,Mary-Anne Boermans,Mary-Anne,9,IN,"Roasted Cauliflower, Cheese andCaramelised Onion Quiche",Butterscotch Brulée Tarts in Pecan PastryApple Rose Tarts,45,Housewife,"Kidderminster, Worcestershire"
2,3,Mary-Anne Boermans,Mary-Anne,5,IN,Ploughman's Loaf,Herb and Walnut BreadsChocolate and Chilli Buns,45,Housewife,"Kidderminster, Worcestershire"
2,4,Mary-Anne Boermans,Mary-Anne,2,IN,Melting Moments,Blackcurrant and Mint MacaronsGooseberry and Elderflower MacaronsHazelnut Macarons,45,Housewife,"Kidderminster, Worcestershire"
2,5,Mary-Anne Boermans,Mary-Anne,2,IN,Chicken and Bacon Pie,Midnight Meringue,45,Housewife,"Kidderminster, Worcestershire"
2,6,Mary-Anne Boermans,Mary-Anne,4,IN,Tutti Fruitti Curd Baked Cheesecake,Orange and Praline Croquembouche with Cardamom Caramel,45,Housewife,"Kidderminster, Worcestershire"
2,7,Mary-Anne Boermans,Mary-Anne,2,IN,Chocolate and Orange Mousse Cake,Raspberry Rose DanishesPraline SpiralsAlsatian Plaited Danishes,45,Housewife,"Kidderminster, Worcestershire"
2,8,Mary-Anne Boermans,Mary-Anne,3,Runner-up,Lemon and Ginger Mille Feuille,Fruit Tarts with Elderflower CustardStrawberry and Rhubarb CheesecakesBlack Fruit Meringue with Everlasting Syllabub,45,Housewife,"Kidderminster, Worcestershire"
2,1,Robert Billington,Robert,3,IN,Blackberry and Vanilla Cupcakeswith Liquorice Frosting,Genoise Layered Mousse Cakewith Chocolate Ganache,25,Photographer,London
2,2,Robert Billington,Robert,5,IN,Smoked Bacon and Kale Quiche,"Chocolate, Fennel and Ginger TartAlmond, Creme Patissiere and Poached Pear Tart",25,Photographer,London
2,3,Robert Billington,Robert,4,IN,Rye and Coriander Seed Loaf,Blueberry Brioche RollsLemon and Poppy Seed Rolls,25,Photographer,London
2,4,Robert Billington,Robert,7,IN,Chocolate and Ginger Oat Biscuits,Strawberry and Lime MacaronsLemon MacaronsChocolate and Cardamom Macarons,25,Photographer,London
2,5,Robert Billington,Robert,3,OUT,Chicken and Mushroom Pie,Rhubarb and Custard Meringue Pie,25,Photographer,London
2,6,Robert Billington,Robert,NA,NA,NA,NA,25,Photographer,London
2,7,Robert Billington,Robert,NA,NA,NA,NA,25,Photographer,London
2,8,Robert Billington,Robert,NA,NA,NA,NA,25,Photographer,London
2,1,Simon Blackwell,Simon,9,IN,Guinness and Chocolate Cupcakes,Two-Tiered Chocolate Courgette Cake,31,Rugby Coach,Norfolk
2,2,Simon Blackwell,Simon,11,OUT,Smoked Haddock and Watercress Quiche,"Passion Fruit and Ricotta TartsSalted Chocolate, Stem Ginger and Mascarpone Cream Tarts",31,Rugby Coach,Norfolk
2,3,Simon Blackwell,Simon,NA,NA,NA,NA,31,Rugby Coach,Norfolk
2,4,Simon Blackwell,Simon,NA,NA,NA,NA,31,Rugby Coach,Norfolk
2,5,Simon Blackwell,Simon,NA,NA,NA,NA,31,Rugby Coach,Norfolk
2,6,Simon Blackwell,Simon,NA,NA,NA,NA,31,Rugby Coach,Norfolk
2,7,Simon Blackwell,Simon,NA,NA,NA,NA,31,Rugby Coach,Norfolk
2,8,Simon Blackwell,Simon,NA,NA,NA,NA,31,Rugby Coach,Norfolk
2,1,Urvashi Roe,Urvashi,7,IN,Cherry Blossom CupcakesJapanese Lime Cupcakes,UNKNOWN,40,Head of Marketing,"Enfield, London"
2,2,Urvashi Roe,Urvashi,7,IN,"Crab, Coriander and Coconut Quiche",Strawberry and Basil TartsElderflower and Honeycomb Tarts,40,Head of Marketing,"Enfield, London"
2,3,Urvashi Roe,Urvashi,9,OUT,Salt and Peppercorn Loaf,Chilli and Halloumi RollsLemon and Coriander Mini Loaves,40,Head of Marketing,"Enfield, London"
2,4,Urvashi Roe,Urvashi,NA,NA,NA,NA,40,Head of Marketing,"Enfield, London"
2,5,Urvashi Roe,Urvashi,NA,NA,NA,NA,40,Head of Marketing,"Enfield, London"
2,6,Urvashi Roe,Urvashi,NA,NA,NA,NA,40,Head of Marketing,"Enfield, London"
2,7,Urvashi Roe,Urvashi,NA,NA,NA,NA,40,Head of Marketing,"Enfield, London"
2,8,Urvashi Roe,Urvashi,NA,NA,NA,NA,40,Head of Marketing,"Enfield, London"
2,1,Yasmin Limbert,Yasmin,5,IN,Cardamom and Pomegranate Cupcakes,UNKNOWN,43,Childminder,"West Kirby, The Wirral"
2,2,Yasmin Limbert,Yasmin,6,IN,Smoked Haddock and Watercress Quiche,Chocolate and Orange with Cinnamon-Orange Pastry TartsBlueberry and Hazelnut with Hazelnut Pastry Tarts,43,Childminder,"West Kirby, The Wirral"
2,3,Yasmin Limbert,Yasmin,2,STAR BAKER,Egyptian Dukkah Loaf with Mixed Spices,"Pesto Bread
Sweet Coconut Rolls",43,Childminder,"West Kirby, The Wirral"
2,4,Yasmin Limbert,Yasmin,6,IN,Chocolate Chip and Pistachio Biscotti,Chocolate and Lime MacaronsCoffee and Walnut MacaronsPineapple and Coconut Macarons,43,Childminder,"West Kirby, The Wirral"
2,5,Yasmin Limbert,Yasmin,5,IN,Family Fish Pie,Peach and Raspberry Meringue Pie,43,Childminder,"West Kirby, The Wirral"
2,6,Yasmin Limbert,Yasmin,2,OUT,Baked Amaretto Cheesecake,Rose Croquembouche,43,Childminder,"West Kirby, The Wirral"
2,7,Yasmin Limbert,Yasmin,NA,NA,NA,NA,43,Childminder,"West Kirby, The Wirral"
2,8,Yasmin Limbert,Yasmin,NA,NA,NA,NA,43,Childminder,"West Kirby, The Wirral"
2,1,NA,Joanne,11,IN,NA,NA,NA,NA,NA
2,2,NA,Joanne,10,IN,NA,NA,NA,NA,NA
2,3,NA,Joanne,1,IN,NA,NA,NA,NA,NA
2,4,NA,Joanne,8,IN,NA,NA,NA,NA,NA
2,5,NA,Joanne,6,IN,NA,NA,NA,NA,NA
2,6,NA,Joanne,1,STAR BAKER,NA,NA,NA,NA,NA
2,7,NA,Joanne,3,IN,NA,NA,NA,NA,NA
2,8,NA,Joanne,1,WINNER,NA,NA,NA,NA,NA
3,1,Brendan Lynch,Brendan,10,IN,"Plum, Sour Cherry & Walnut",UNKNOWN,63,Recruitment consultant,Sutton Coldfield
3,2,Brendan Lynch,Brendan,4,IN,Middle Eastern Taboon BreadIndian Rotis,"Chocolate and Vanilla Bagels
Cumin and Gruyere Bagels",63,Recruitment consultant,Sutton Coldfield
3,3,Brendan Lynch,Brendan,9,IN,Apple and Ginger Tarte Tatin,"Blackberry, Nectarine and Dragon Fruit Tart",63,Recruitment consultant,Sutton Coldfield
3,4,Brendan Lynch,Brendan,1,STAR BAKER,Clementine and Chestnut Torte,"Pear, Chocolate and Hazelnut Dacquoise",63,Recruitment consultant,Sutton Coldfield
3,5,Brendan Lynch,Brendan,3,IN,Salmon Coulibiac in a Scandinavian Pastry,All American Chiffon Pie,63,Recruitment consultant,Sutton Coldfield
3,6,Brendan Lynch,Brendan,1,STAR BAKER,"Rhubarb, Strawberry and Ginger Puddings
Sticky Toffee Puddings","Spinach, Cheese and Walnut Strudel",63,Recruitment consultant,Sutton Coldfield
3,7,Brendan Lynch,Brendan,4,IN,Chelsea Bunskis,Black Forest Christmas Stollen,63,Recruitment consultant,Sutton Coldfield
3,8,Brendan Lynch,Brendan,2,IN,Multi-Seed Savoury Crackers,Fantasy Gingerbread Bird House,63,Recruitment consultant,Sutton Coldfield
3,9,Brendan Lynch,Brendan,3,IN,Coffee Meringue and Hazelnut CreamsApricot and Pistachio FriandsLime Curd Choux Pastry Cygnets,Gateau St. Honoré,63,Recruitment consultant,Sutton Coldfield
3,10,Brendan Lynch,Brendan,2,Runner-up,Potato and Pepper Pithivier,Family Reunion Chiffon Cake,63,Recruitment consultant,Sutton Coldfield
3,1,Cathryn Dresser,Cathryn,5,IN,"Apple, Hazelnut and Calvados",Hidden Cupcake Cake,27,Shop assistant,"Pease Pottage, West Sussex"
3,2,Cathryn Dresser,Cathryn,8,IN,"Spiced Mango NaanLime, Coriander and Chilli Tortillas","Cranberry and Orange Bagels
Chipotle, Chili, and Smoked Cheddar Bagels",27,Shop assistant,"Pease Pottage, West Sussex"
3,3,Cathryn Dresser,Cathryn,3,IN,"Plum, Cherry and Five Spice Tarte Tatin","Raspberry, Pistachio and Lemon Tart",27,Shop assistant,"Pease Pottage, West Sussex"
3,4,Cathryn Dresser,Cathryn,3,IN,"White Chocolate, Macadamia and Coffee Torte","Gooseberry, Almond and Honey Meringue",27,Shop assistant,"Pease Pottage, West Sussex"
3,5,Cathryn Dresser,Cathryn,1,IN,Full English Wellington,Chocolate and Peanut Butter Pumpkin Pie,27,Shop assistant,"Pease Pottage, West Sussex"
3,6,Cathryn Dresser,Cathryn,3,IN,"Chocolate Walnut Whip Puddings
Elderflower Sponges",Roasted Vegetable Couscous and Sheep Cheese Strudel,27,Shop assistant,"Pease Pottage, West Sussex"
3,7,Cathryn Dresser,Cathryn,5,IN,Lady Arundel's Manchet Buns,Bonfire Night Tear 'n' Share Brioche,27,Shop assistant,"Pease Pottage, West Sussex"
3,8,Cathryn Dresser,Cathryn,5,OUT,Cheese and Pickle Crackers,Gingerbread Buckingham Palace,27,Shop assistant,"Pease Pottage, West Sussex"
3,9,Cathryn Dresser,Cathryn,NA,NA,NA,NA,27,Shop assistant,"Pease Pottage, West Sussex"
3,10,Cathryn Dresser,Cathryn,NA,NA,NA,NA,27,Shop assistant,"Pease Pottage, West Sussex"
3,1,Danny Bryden,Danny,7,IN,"Plum, Ginger & Orange",UNKNOWN,45,Intensive care consultant,Sheffield
3,2,Danny Bryden,Danny,3,IN,Lime Coriander and Coconut TortillasZaatar Naan with Dukkah,UNKNOWN,45,Intensive care consultant,Sheffield
3,3,Danny Bryden,Danny,2,IN,Savoury Pear and Roquefort Tarte Tatin,"Pineapple, Coconut and Frangipane Tart",45,Intensive care consultant,Sheffield
3,4,Danny Bryden,Danny,2,IN,"Blackberry, White Chocolate, Lemon and Elderflower Torte","'Monte Bianco' Chestnut, Chocolate and Coffee Dacquoise",45,Intensive care consultant,Sheffield
3,5,Danny Bryden,Danny,7,IN,"Chickpea, Spinach & Mushroom Wellington",Trick or Treat Pumpkin Pie,45,Intensive care consultant,Sheffield
3,6,Danny Bryden,Danny,2,IN,Banoffee Puddings with Walnut Butterscotch SauceJubilee Chocolate Fondants,"Leek, Potato, Pistachio and Gruyère Strudel",45,Intensive care consultant,Sheffield
3,7,Danny Bryden,Danny,2,STAR BAKER,Bakewell Chelsea Buns,European Christmas Wreath,45,Intensive care consultant,Sheffield
3,8,Danny Bryden,Danny,4,IN,Spiced Almond Drinks Crackers,Gingerbread Big Ben,45,Intensive care consultant,Sheffield
3,9,Danny Bryden,Danny,4,OUT,Blackberry and Peppermint MacaroonsMiniature Raspberry and Basil FinanciersOrange and White Chocolate Langues de Chat,Rosewater and Lychee St. Honoré,45,Intensive care consultant,Sheffield
3,10,Danny Bryden,Danny,NA,NA,NA,NA,45,Intensive care consultant,Sheffield
3,1,James Morton,James,2,IN,"Parsnip, Pear, and Pecan","""Simmer Dim"" Sunset Cake",21,Medical student,"Hillswick, Shetland Islands"
3,2,James Morton,James,2,IN,"Tomato, Garlic, and Parmesan FlatbreadsTattie Scones","Orange, Mint and Chocolate Bagels
'Millers' Sourdough Bagels",21,Medical student,"Hillswick, Shetland Islands"
3,3,James Morton,James,1,STAR BAKER,Apple and Lavender Tarte Tatin,"Rose, Lychee and Raspberry Fruit Tart",21,Medical student,"Hillswick, Shetland Islands"
3,4,James Morton,James,5,IN,"Hazelnut, Chocolate and Passionfruit Torte","Fig, Chestnut, Cherry and Chocolate Layered Meringue",21,Medical student,"Hillswick, Shetland Islands"
3,5,James Morton,James,6,IN,Four Pig Wellington,Sweet Potato Pie,21,Medical student,"Hillswick, Shetland Islands"
3,6,James Morton,James,7,IN,Banana and Clove PuddingsClootie Dumplings,"Strawberry, Rhubarb and Ginger Strudel",21,Medical student,"Hillswick, Shetland Islands"
3,7,James Morton,James,1,IN,Easter Chelsea Buns,Whisky Kugelhopf-Brioche Baba,21,Medical student,"Hillswick, Shetland Islands"
3,8,James Morton,James,1,STAR BAKER,"Smoky Cayenne, Cumin and Chilli Crackers",Gingerbread Barn,21,Medical student,"Hillswick, Shetland Islands"
3,9,James Morton,James,1,STAR BAKER,"Lemon and Rhubarb TartletsChocolate Indulgence Petits FoursChilli, Lime and Raspberry Macaroons","Coffee, Caramel and Hazelnut Paris-Brest",21,Medical student,"Hillswick, Shetland Islands"
3,10,James Morton,James,1,Runner-up,Spanish Pithivier with Chorizo and Red Pepper,United Chiffon Cakes,21,Medical student,"Hillswick, Shetland Islands"
3,1,John Whaite,John,11,IN,"Toffee Apple, Orange & Cranberry",Hidden Pink Hearts Cake,22,Law student,Wigan
3,2,John Whaite,John,1,STAR BAKER,"Coriander and Chilli RotisGarlic, Pomegranate and Potato Pitas","Fig, Walnut and Gruyere Bagels
Blueberry and White Chocolate Bagels",22,Law student,Wigan
3,3,John Whaite,John,6,IN,Apple and Vanilla Tarte Tatin with Walnut Praline,"Berries, Grapes, Pomegranate, and Dragon Fruit Tart",22,Law student,Wigan
3,4,John Whaite,John,6,IN,'Torte Noir' Black Forest Torte with Boozy Cream,Elderflower and Bramble Berry Pavlova,22,Law student,Wigan
3,5,John Whaite,John,2,IN,Venison and Haggis Wellington,Star-Spangled Pecan Pie,22,Law student,Wigan
3,6,John Whaite,John,5,IN,Spicy Toffee PuddingsRaspberry and White Chocolate Puddings,Did not complete due to injury,22,Law student,Wigan
3,7,John Whaite,John,3,IN,Cherry and Almond Saffron Buns,Marzipan Stollen,22,Law student,Wigan
3,8,John Whaite,John,3,IN,Asian Spice Crackers,Gingerbread Roman Coliseum,22,Law student,Wigan
3,9,John Whaite,John,2,IN,Lemon MadeleinesWhite Chocolate and Raspberry TartletsDark Chocolate and Cherry Macaroons,Gateau St. Honoré a la Passion,22,Law student,Wigan
